{
  "$schema": "https://json-schema.org/draft/2020-12/schema",
  "$id": "https://synapse.kkloudtarus.net/docs/schemas/events/vulnerability_action.created.v1.schema.json",
  "title": "vulnerability_action.created event (v1)",
  "description": "A vulnerability risk action requires review.",
  "type": "object",
  "properties": {
    "id": {
      "type": "string",
      "minLength": 1
    },
    "type": {
      "const": "vulnerability_action.created",
      "type": "string"
    },
    "source_kind": {
      "type": "string",
      "minLength": 1
    },
    "source_id": {
      "type": "string",
      "minLength": 1
    },
    "schema_version": {
      "type": "integer",
      "const": 1
    },
    "occurred_at": {
      "type": "string",
      "format": "date-time"
    },
    "engagement_id": {
      "type": "string"
    },
    "severity": {
      "type": "string",
      "enum": [
        "critical",
        "high",
        "medium",
        "low",
        "info",
        "unknown"
      ]
    },
    "data": {
      "type": "object",
      "properties": {
        "title": {
          "type": "string"
        },
        "summary": {
          "type": "string"
        },
        "action_type": {
          "type": "string",
          "enum": [
            "new_exposure",
            "escalation",
            "withdrawal",
            "reexposure",
            "retest_required",
            "risk_review"
          ]
        },
        "outbox_id": {
          "type": "string",
          "minLength": 1
        }
      },
      "required": [
        "title",
        "summary",
        "action_type",
        "outbox_id"
      ],
      "additionalProperties": true
    }
  },
  "required": [
    "id",
    "type",
    "source_kind",
    "source_id",
    "schema_version",
    "occurred_at",
    "data"
  ],
  "additionalProperties": true
}
