{
  "id": "event-vulnerability_action-created",
  "type": "vulnerability_action.created",
  "source_kind": "vulnerability_action_outbox",
  "source_id": "source-42",
  "schema_version": 1,
  "occurred_at": "2026-09-27T08:00:00Z",
  "engagement_id": "eng-42",
  "severity": "high",
  "data": {
    "title": "Review vulnerable dependency",
    "summary": "A vulnerability risk action requires review.",
    "action_type": "escalation",
    "outbox_id": "outbox-42"
  }
}
